{
  "ev_id": "EV-FR1-22-20261023-1343",
  "req_id": "FR1-22",
  "tc_id": "TC-FR1-22",
  "commit": "a1025638fce6d4a1af5f0a93d7ab2c6b5f833691",
  "tool_hashes": {
    "protein": "a10d21b0e1c16bea5bf6e4fe8591b5b7ccb5c3bf273b733aa1f889059b1275ca",
    "diabetes": "27c0e33ce3b98aea495a2f13fca112e32007d9d478ab30ee70401a39ab496292"
  },
  "fixtures": [
    "FX-PR-AGE-01",
    "FX-PR-AGE-02",
    "FX-PR-AGE-03",
    "FX-PR-AGE-04",
    "FX-PR-AGE-05",
    "FX-PR-BMI-01",
    "FX-PR-BMI-02",
    "FX-PR-BMI-03",
    "FX-PR-BMI-04",
    "FX-PR-CAP-01",
    "FX-PR-CAP-02",
    "FX-PR-CAP-03",
    "FX-PR-INV-01",
    "FX-PR-INV-02",
    "FX-PR-INV-03",
    "FX-PR-INV-04",
    "FX-PR-INV-05",
    "FX-PR-INV-06",
    "FX-PR-INV-07",
    "FX-PR-INV-08",
    "FX-PR-LIV-01",
    "FX-PR-LIV-02",
    "FX-PR-MEAL-01",
    "FX-PR-MEAL-02",
    "FX-PR-MEAL-03",
    "FX-PR-NRM-01",
    "FX-PR-NRM-02",
    "FX-PR-NRM-03",
    "FX-PR-NRM-04",
    "FX-PR-NRM-05",
    "FX-PR-NRM-06",
    "FX-PR-NRM-07",
    "FX-PR-NRM-08",
    "FX-PR-NRM-09",
    "FX-PR-NRM-10",
    "FX-PR-NRM-11",
    "FX-PR-NRM-12",
    "FX-PR-NRM-13",
    "FX-PR-NRM-14",
    "FX-PR-PRG-01",
    "FX-PR-PRG-02",
    "FX-PR-PRG-03",
    "FX-PR-PRG-04",
    "FX-PR-REN-01",
    "FX-PR-REN-02",
    "FX-PR-REN-03",
    "FX-PR-REN-04",
    "FX-PR-UNIT-01",
    "FX-PR-UNIT-02",
    "FX-PR-UNIT-03",
    "FX-PR-UNS-01",
    "FX-PR-UWT-01",
    "FX-PR-UWT-02",
    "FX-DM-BAND-01",
    "FX-DM-BAND-02",
    "FX-DM-BAND-03",
    "FX-DM-BAND-04",
    "FX-DM-BAND-05",
    "FX-DM-BAND-06",
    "FX-DM-BAND-07",
    "FX-DM-BAND-08",
    "FX-DM-BAND-09",
    "FX-DM-BAND-10",
    "FX-DM-BAND-11",
    "FX-DM-BAND-12",
    "FX-DM-QD-CLAMP-01",
    "FX-DM-QD-CLAMP-02",
    "FX-DM-QD-CLAMP-03",
    "FX-DM-QD-CLAMP-04",
    "FX-DM-CONC-01",
    "FX-DM-CONC-02",
    "FX-DM-NOWAIST-01",
    "FX-DM-EMG-01",
    "FX-DM-EMG-02",
    "FX-DM-IDRS-01",
    "FX-DM-IDRS-02",
    "FX-DM-IDRS-03",
    "FX-DM-IDRS-04",
    "FX-DM-IDRS-05",
    "FX-DM-IDRS-06",
    "FX-DM-INV-01",
    "FX-DM-INV-02",
    "FX-DM-INV-03",
    "FX-DM-INV-04",
    "FX-DM-INV-05",
    "FX-DM-QD-01",
    "FX-DM-QD-02",
    "FX-DM-QD-03",
    "FX-DM-QD-04",
    "FX-DM-QD-05",
    "FX-DM-QD-06",
    "FX-DM-QD-07",
    "FX-DM-QD-08",
    "FX-DM-QD-09",
    "FX-DM-QD-10",
    "FX-DM-QD-11",
    "FX-DM-QD-12",
    "FX-DM-QD-13",
    "FX-DM-QD-14",
    "FX-DM-QD-15",
    "FX-DM-QD-16",
    "FX-DM-QD-17",
    "FX-DM-QD-18",
    "FX-DM-QD-19",
    "FX-DM-QD-20",
    "FX-DM-QD-21",
    "FX-DM-QD-22",
    "FX-DM-QD-23",
    "FX-DM-QD-24",
    "FX-DM-QD-25",
    "FX-DM-QD-26",
    "FX-DM-QD-27",
    "FX-DM-QD-28",
    "FX-DM-QD-29",
    "FX-DM-QD-30",
    "FX-DM-QD-31",
    "FX-DM-QD-32",
    "FX-DM-QD-33",
    "FX-DM-QD-34",
    "FX-DM-QD-35",
    "FX-DM-QD-36",
    "FX-DM-QD-37",
    "FX-DM-QD-38",
    "FX-DM-QD-39",
    "FX-DM-QD-40",
    "FX-DM-QD-41",
    "FX-DM-QD-42",
    "FX-DM-QD-43",
    "FX-DM-QD-44",
    "FX-DM-QD-45",
    "FX-DM-QD-46",
    "FX-DM-QD-47",
    "FX-DM-QD-48",
    "FX-DM-QD-49",
    "FX-DM-QD-50",
    "FX-DM-QD-51",
    "FX-DM-QD-52",
    "FX-DM-QD-53",
    "FX-DM-QD-54",
    "FX-DM-QD-55",
    "FX-DM-QD-56",
    "FX-DM-QD-57",
    "FX-DM-QD-58",
    "FX-DM-QD-59",
    "FX-DM-QD-60",
    "FX-DM-QD-61",
    "FX-DM-QD-62",
    "FX-DM-QD-63",
    "FX-DM-QD-64",
    "FX-DM-QD-65",
    "FX-DM-QD-66",
    "FX-DM-QD-67",
    "FX-DM-QD-68",
    "FX-DM-QD-69",
    "FX-DM-QD-70",
    "FX-DM-QD-71",
    "FX-DM-QD-72",
    "FX-DM-QD-73",
    "FX-DM-QD-74",
    "FX-DM-SYM-01",
    "FX-DM-SYM-02",
    "FX-DM-SYM-03",
    "FX-DM-WHTR-01",
    "FX-DM-WHTR-02",
    "FX-DM-WHTR-03",
    "FX-DM-WHTR-04"
  ],
  "results": [
    {
      "assertion": "TC-FR1-22-AS-01",
      "outcome": "skipped",
      "artefact": "ORC-02/03/04 reproduce from a clean checkout (pass); ORC-01 container cannot run — no Docker daemon (WSL 2 missing, OI-4), deferred to HG-02 in approvals/hg-01.json",
      "oracle": "characterisation"
    },
    {
      "assertion": "TC-FR1-22-AS-02",
      "outcome": "pass",
      "artefact": "artefacts/vitest.json",
      "oracle": "characterisation"
    },
    {
      "assertion": "TC-FR1-22-AS-03",
      "outcome": "pass",
      "artefact": "artefacts/vitest.json",
      "oracle": "characterisation"
    },
    {
      "assertion": "TC-FR1-22-AS-04",
      "outcome": "pass",
      "artefact": "artefacts/vitest.json",
      "oracle": "characterisation"
    },
    {
      "assertion": "TC-FR1-06-AS-01",
      "outcome": "pass",
      "artefact": "artefacts/vitest.json",
      "oracle": "characterisation"
    },
    {
      "assertion": "TC-FR1-06-AS-02",
      "outcome": "pass",
      "artefact": "artefacts/vitest.json",
      "oracle": "characterisation"
    },
    {
      "assertion": "TC-FR1-06-AS-04",
      "outcome": "pass",
      "artefact": "artefacts/vitest.json",
      "oracle": "characterisation"
    },
    {
      "assertion": "SAF-DM-01",
      "outcome": "pass",
      "artefact": "artefacts/vitest.json",
      "oracle": "characterisation"
    },
    {
      "assertion": "SAF-DM-02",
      "outcome": "pass",
      "artefact": "artefacts/vitest.json",
      "oracle": "characterisation"
    },
    {
      "assertion": "SAF-DM-03",
      "outcome": "pass",
      "artefact": "artefacts/vitest.json",
      "oracle": "characterisation"
    },
    {
      "assertion": "SAF-DM-04",
      "outcome": "pass",
      "artefact": "artefacts/vitest.json",
      "oracle": "characterisation"
    },
    {
      "assertion": "SAF-CROSS-01",
      "outcome": "skipped",
      "artefact": "artefacts/vitest.json",
      "oracle": "characterisation"
    },
    {
      "assertion": "SAF-WITHDRAW-01",
      "outcome": "skipped",
      "artefact": "artefacts/vitest.json",
      "oracle": "characterisation"
    },
    {
      "assertion": "SAF-PR-01",
      "outcome": "pass",
      "artefact": "artefacts/vitest.json",
      "oracle": "characterisation"
    },
    {
      "assertion": "SAF-PR-02",
      "outcome": "pass",
      "artefact": "artefacts/vitest.json",
      "oracle": "characterisation"
    },
    {
      "assertion": "SAF-PR-03",
      "outcome": "pass",
      "artefact": "artefacts/vitest.json",
      "oracle": "characterisation"
    },
    {
      "assertion": "SAF-PR-04",
      "outcome": "pass",
      "artefact": "artefacts/vitest.json",
      "oracle": "characterisation"
    },
    {
      "assertion": "TC-FR1-20-AS-01",
      "outcome": "pass",
      "artefact": "artefacts/vitest.json",
      "oracle": "characterisation"
    },
    {
      "assertion": "TC-FR1-20-AS-02",
      "outcome": "pass",
      "artefact": "artefacts/vitest.json",
      "oracle": "characterisation"
    },
    {
      "assertion": "TC-FR1-20-AS-03",
      "outcome": "pass",
      "artefact": "artefacts/vitest.json",
      "oracle": "characterisation"
    }
  ],
  "mutations": [],
  "red_run": "local-20261023-1341",
  "green_run": "local-20261023-1343",
  "human_gate": null,
  "started_at": "2026-10-23T13:40:00Z",
  "finished_at": "2026-10-23T13:45:12Z"
}
