{
  "ev_id": "EV-NFR1-09-20261023-1840",
  "req_id": "NFR1-09",
  "tc_id": "TC-NFR1-09",
  "commit": "1f7d876e868492511a4bc8d31c174aa1fdce7e28",
  "tool_hashes": {
    "protein": "65cffa501f924b7e760d5f03f91b6148e9b5506c5b62b9013e00acd4be4968c0",
    "diabetes": "933063cedbf4644c772863f6e6da4a68a268793c5ccba897ff88a1d94ac9826e"
  },
  "fixtures": [],
  "results": [
    {
      "assertion": "TC-NFR1-09-AS-01",
      "outcome": "pass",
      "artefact": "artefacts/vitest.json",
      "oracle": "none"
    },
    {
      "assertion": "TC-NFR1-09-AS-02",
      "outcome": "pass",
      "artefact": "artefacts/vitest.json",
      "oracle": "none"
    },
    {
      "assertion": "TC-NFR1-09-AS-03",
      "outcome": "pass",
      "artefact": "artefacts/vitest.json",
      "oracle": "none"
    },
    {
      "assertion": "TC-NFR1-09-AS-04",
      "outcome": "pass",
      "artefact": "artefacts/vitest.json",
      "oracle": "none"
    }
  ],
  "mutations": [],
  "red_run": "local-20261023-1832",
  "green_run": "local-20261023-1840",
  "human_gate": null,
  "started_at": "2026-10-23T17:30:00Z",
  "finished_at": "2026-10-23T16:38:19Z"
}
