{
  "ev_id": "EV-NFR1-09-20261023-1501",
  "req_id": "NFR1-09",
  "tc_id": "TC-NFR1-09",
  "commit": "de8b2c3c94ab4ad7d101f84eacc8361d18e5b857",
  "tool_hashes": {
    "protein": "65cffa501f924b7e760d5f03f91b6148e9b5506c5b62b9013e00acd4be4968c0",
    "diabetes": "933063cedbf4644c772863f6e6da4a68a268793c5ccba897ff88a1d94ac9826e"
  },
  "fixtures": [],
  "results": [
    {
      "assertion": "TC-NFR1-09-AS-01",
      "outcome": "pass",
      "artefact": "artefacts/vitest.json",
      "oracle": "none"
    },
    {
      "assertion": "TC-NFR1-09-AS-02",
      "outcome": "pass",
      "artefact": "structural job set unchanged (20 jobs); SPEC PRs skip the test-family jobs by design (DEC-55)",
      "oracle": "none"
    },
    {
      "assertion": "TC-NFR1-09-AS-03",
      "outcome": "pass",
      "artefact": "artefacts/vitest.json",
      "oracle": "none"
    },
    {
      "assertion": "TC-NFR1-09-AS-04",
      "outcome": "pass",
      "artefact": "artefacts/vitest.json",
      "oracle": "none"
    },
    {
      "assertion": "TC-FR1-22-AS-01",
      "outcome": "skipped",
      "artefact": "artefacts/vitest.json",
      "oracle": "none"
    },
    {
      "assertion": "TC-FR1-22-AS-02",
      "outcome": "pass",
      "artefact": "artefacts/vitest.json",
      "oracle": "none"
    },
    {
      "assertion": "TC-FR1-22-AS-03",
      "outcome": "pass",
      "artefact": "artefacts/vitest.json",
      "oracle": "none"
    },
    {
      "assertion": "TC-FR1-22-AS-04",
      "outcome": "pass",
      "artefact": "artefacts/vitest.json",
      "oracle": "none"
    },
    {
      "assertion": "TC-FR1-06-AS-01",
      "outcome": "pass",
      "artefact": "artefacts/vitest.json",
      "oracle": "none"
    },
    {
      "assertion": "TC-FR1-06-AS-02",
      "outcome": "pass",
      "artefact": "artefacts/vitest.json",
      "oracle": "none"
    },
    {
      "assertion": "TC-FR1-06-AS-04",
      "outcome": "pass",
      "artefact": "artefacts/vitest.json",
      "oracle": "none"
    },
    {
      "assertion": "TC-FR1-20-AS-01",
      "outcome": "pass",
      "artefact": "artefacts/vitest.json",
      "oracle": "none"
    },
    {
      "assertion": "TC-FR1-20-AS-02",
      "outcome": "pass",
      "artefact": "artefacts/vitest.json",
      "oracle": "none"
    },
    {
      "assertion": "TC-FR1-20-AS-03",
      "outcome": "pass",
      "artefact": "artefacts/vitest.json",
      "oracle": "none"
    },
    {
      "assertion": "TC-NFR1-15-AS-01",
      "outcome": "pass",
      "artefact": "artefacts/vitest.json",
      "oracle": "none"
    },
    {
      "assertion": "TC-FR1-21-AS-02",
      "outcome": "pass",
      "artefact": "artefacts/vitest.json",
      "oracle": "none"
    },
    {
      "assertion": "TC-FR1-21-AS-04",
      "outcome": "pass",
      "artefact": "artefacts/vitest.json",
      "oracle": "none"
    },
    {
      "assertion": "TC-FR1-21-AS-06",
      "outcome": "pass",
      "artefact": "artefacts/vitest.json",
      "oracle": "none"
    },
    {
      "assertion": "SAF-DM-01",
      "outcome": "pass",
      "artefact": "artefacts/vitest.json",
      "oracle": "characterisation"
    },
    {
      "assertion": "SAF-DM-02",
      "outcome": "pass",
      "artefact": "artefacts/vitest.json",
      "oracle": "characterisation"
    },
    {
      "assertion": "SAF-DM-03",
      "outcome": "pass",
      "artefact": "artefacts/vitest.json",
      "oracle": "characterisation"
    },
    {
      "assertion": "SAF-DM-04",
      "outcome": "pass",
      "artefact": "artefacts/vitest.json",
      "oracle": "characterisation"
    },
    {
      "assertion": "SAF-CROSS-01",
      "outcome": "skipped",
      "artefact": "artefacts/vitest.json",
      "oracle": "characterisation"
    },
    {
      "assertion": "SAF-WITHDRAW-01",
      "outcome": "skipped",
      "artefact": "artefacts/vitest.json",
      "oracle": "characterisation"
    },
    {
      "assertion": "SAF-PR-01",
      "outcome": "pass",
      "artefact": "artefacts/vitest.json",
      "oracle": "characterisation"
    },
    {
      "assertion": "SAF-PR-02",
      "outcome": "pass",
      "artefact": "artefacts/vitest.json",
      "oracle": "characterisation"
    },
    {
      "assertion": "SAF-PR-03",
      "outcome": "pass",
      "artefact": "artefacts/vitest.json",
      "oracle": "characterisation"
    },
    {
      "assertion": "SAF-PR-04",
      "outcome": "pass",
      "artefact": "artefacts/vitest.json",
      "oracle": "characterisation"
    }
  ],
  "mutations": [],
  "red_run": null,
  "green_run": "local-20261023-1501",
  "human_gate": null,
  "started_at": "2026-10-23T15:00:00Z",
  "finished_at": "2026-10-23T15:02:07Z"
}
