{
  "ev_id": "EV-FR1-21-20261023-1335",
  "req_id": "FR1-21",
  "tc_id": "TC-FR1-21",
  "commit": "dca1fbb6f68603314c3b824feb25e05b2a2590f8",
  "tool_hashes": {
    "protein": "65cffa501f924b7e760d5f03f91b6148e9b5506c5b62b9013e00acd4be4968c0",
    "diabetes": "933063cedbf4644c772863f6e6da4a68a268793c5ccba897ff88a1d94ac9826e"
  },
  "fixtures": [],
  "results": [
    {
      "assertion": "TC-FR1-21-AS-01",
      "outcome": "pass",
      "artefact": "tests/e2e/harness/landing.html (landing-page double served by the .htaccess emulator; crawl of the WordPress pages when LLD_WP_URL is set)",
      "oracle": "none"
    },
    {
      "assertion": "TC-FR1-21-AS-02",
      "outcome": "pass",
      "artefact": "artefacts/vitest.json",
      "oracle": "none"
    },
    {
      "assertion": "TC-FR1-21-AS-03",
      "outcome": "pass",
      "artefact": "artefacts/playwright.json",
      "oracle": "none"
    },
    {
      "assertion": "TC-FR1-21-AS-04",
      "outcome": "pass",
      "artefact": "artefacts/vitest.json",
      "oracle": "none"
    },
    {
      "assertion": "TC-FR1-21-AS-05",
      "outcome": "pass",
      "artefact": "artefacts/playwright.json",
      "oracle": "none"
    },
    {
      "assertion": "TC-FR1-21-AS-06",
      "outcome": "pass",
      "artefact": "artefacts/vitest.json",
      "oracle": "none"
    },
    {
      "assertion": "TC-FR1-06-AS-01",
      "outcome": "pass",
      "artefact": "artefacts/vitest.json",
      "oracle": "none"
    },
    {
      "assertion": "TC-FR1-06-AS-02",
      "outcome": "pass",
      "artefact": "artefacts/vitest.json",
      "oracle": "none"
    },
    {
      "assertion": "TC-FR1-06-AS-04",
      "outcome": "pass",
      "artefact": "artefacts/vitest.json",
      "oracle": "none"
    },
    {
      "assertion": "SAF-DM-01",
      "outcome": "pass",
      "artefact": "artefacts/vitest.json",
      "oracle": "characterisation"
    },
    {
      "assertion": "SAF-DM-02",
      "outcome": "pass",
      "artefact": "artefacts/vitest.json",
      "oracle": "characterisation"
    },
    {
      "assertion": "SAF-DM-03",
      "outcome": "pass",
      "artefact": "artefacts/vitest.json",
      "oracle": "characterisation"
    },
    {
      "assertion": "SAF-DM-04",
      "outcome": "pass",
      "artefact": "artefacts/vitest.json",
      "oracle": "characterisation"
    },
    {
      "assertion": "SAF-CROSS-01",
      "outcome": "skipped",
      "artefact": "artefacts/vitest.json",
      "oracle": "characterisation"
    },
    {
      "assertion": "SAF-WITHDRAW-01",
      "outcome": "skipped",
      "artefact": "artefacts/vitest.json",
      "oracle": "characterisation"
    },
    {
      "assertion": "SAF-PR-01",
      "outcome": "pass",
      "artefact": "artefacts/vitest.json",
      "oracle": "characterisation"
    },
    {
      "assertion": "SAF-PR-02",
      "outcome": "pass",
      "artefact": "artefacts/vitest.json",
      "oracle": "characterisation"
    },
    {
      "assertion": "SAF-PR-03",
      "outcome": "pass",
      "artefact": "artefacts/vitest.json",
      "oracle": "characterisation"
    },
    {
      "assertion": "SAF-PR-04",
      "outcome": "pass",
      "artefact": "artefacts/vitest.json",
      "oracle": "characterisation"
    },
    {
      "assertion": "TC-FR1-20-AS-01",
      "outcome": "pass",
      "artefact": "artefacts/vitest.json",
      "oracle": "none"
    },
    {
      "assertion": "TC-FR1-20-AS-02",
      "outcome": "pass",
      "artefact": "artefacts/vitest.json",
      "oracle": "none"
    },
    {
      "assertion": "TC-FR1-20-AS-03",
      "outcome": "pass",
      "artefact": "artefacts/vitest.json",
      "oracle": "none"
    },
    {
      "assertion": "TC-FR1-06-AS-03",
      "outcome": "skipped",
      "artefact": "artefacts/playwright.json",
      "oracle": "none"
    },
    {
      "assertion": "TC-NFR1-15-AS-02",
      "outcome": "pass",
      "artefact": "artefacts/playwright.json",
      "oracle": "none"
    }
  ],
  "mutations": [
    {
      "id": "MUT-12",
      "red": true,
      "run": "local-20261023-1335"
    }
  ],
  "red_run": "local-20261023-1328",
  "green_run": "local-20261023-1335",
  "human_gate": null,
  "started_at": "2026-10-23T13:28:00Z",
  "finished_at": "2026-10-23T13:39:58Z"
}
