{
  "ev_id": "EV-FR1-06-20261023-1315",
  "req_id": "FR1-06",
  "tc_id": "TC-FR1-06",
  "commit": "d2bb156defb1c830f09d5dcf03843cbe4b05c400",
  "tool_hashes": {
    "protein": "a10d21b0e1c16bea5bf6e4fe8591b5b7ccb5c3bf273b733aa1f889059b1275ca",
    "diabetes": "27c0e33ce3b98aea495a2f13fca112e32007d9d478ab30ee70401a39ab496292"
  },
  "fixtures": [],
  "results": [
    {
      "assertion": "TC-FR1-06-AS-01",
      "outcome": "pass",
      "artefact": "artefacts/vitest.json",
      "oracle": "none"
    },
    {
      "assertion": "TC-FR1-06-AS-02",
      "outcome": "pass",
      "artefact": "artefacts/vitest.json",
      "oracle": "none"
    },
    {
      "assertion": "TC-FR1-06-AS-03",
      "outcome": "skipped",
      "artefact": "landing-page methodology section (data-lld-deployed-version) is delivered by FR1-04/lld-tools (CMP-09); spec tests/e2e/TC-FR1-06.spec.mjs re-runs when LLD_WP_URL serves it",
      "oracle": "none"
    },
    {
      "assertion": "TC-FR1-06-AS-04",
      "outcome": "pass",
      "artefact": "artefacts/vitest.json",
      "oracle": "none"
    },
    {
      "assertion": "SAF-DM-01",
      "outcome": "pass",
      "artefact": "artefacts/vitest.json",
      "oracle": "characterisation"
    },
    {
      "assertion": "SAF-DM-02",
      "outcome": "pass",
      "artefact": "artefacts/vitest.json",
      "oracle": "characterisation"
    },
    {
      "assertion": "SAF-DM-03",
      "outcome": "pass",
      "artefact": "artefacts/vitest.json",
      "oracle": "characterisation"
    },
    {
      "assertion": "SAF-DM-04",
      "outcome": "pass",
      "artefact": "artefacts/vitest.json",
      "oracle": "characterisation"
    },
    {
      "assertion": "SAF-CROSS-01",
      "outcome": "skipped",
      "artefact": "artefacts/vitest.json",
      "oracle": "characterisation"
    },
    {
      "assertion": "SAF-WITHDRAW-01",
      "outcome": "skipped",
      "artefact": "artefacts/vitest.json",
      "oracle": "characterisation"
    },
    {
      "assertion": "SAF-PR-01",
      "outcome": "pass",
      "artefact": "artefacts/vitest.json",
      "oracle": "characterisation"
    },
    {
      "assertion": "SAF-PR-02",
      "outcome": "pass",
      "artefact": "artefacts/vitest.json",
      "oracle": "characterisation"
    },
    {
      "assertion": "SAF-PR-03",
      "outcome": "pass",
      "artefact": "artefacts/vitest.json",
      "oracle": "characterisation"
    },
    {
      "assertion": "SAF-PR-04",
      "outcome": "pass",
      "artefact": "artefacts/vitest.json",
      "oracle": "characterisation"
    }
  ],
  "mutations": [
    {
      "id": "MUT-10",
      "red": true,
      "run": "local-20261023-1315"
    },
    {
      "id": "MUT-04",
      "red": true,
      "run": "local-20261023-1315"
    },
    {
      "id": "MUT-06",
      "red": true,
      "run": "local-20261023-1315"
    },
    {
      "id": "MUT-07",
      "red": true,
      "run": "local-20261023-1315"
    }
  ],
  "red_run": "local-20261023-1300",
  "green_run": "local-20261023-1315",
  "reviewer": {
    "agent": "P-C",
    "verdict": "PASS",
    "report": "https://github.com/sudarshanalk/lifeline-daily-stage1/pull/4 (P-C review, run local-20261023-1408)"
  },
  "human_gate": {
    "id": "HG-02",
    "artefact": "approvals/protein.json, approvals/diabetes.json",
    "status": "pending"
  },
  "started_at": "2026-10-23T12:50:00Z",
  "finished_at": "2026-10-23T13:15:07Z"
}
