{
  "ev_id": "EV-FR1-07-20261023-1445",
  "req_id": "FR1-07",
  "tc_id": "TC-FR1-07",
  "commit": "b6d90c5393e8d88774b2b94ee56a49add2440f1e",
  "tool_hashes": {
    "protein": "65cffa501f924b7e760d5f03f91b6148e9b5506c5b62b9013e00acd4be4968c0",
    "diabetes": "933063cedbf4644c772863f6e6da4a68a268793c5ccba897ff88a1d94ac9826e"
  },
  "fixtures": [
    "FX-PR-NRM-01",
    "FX-PR-NRM-02",
    "FX-PR-NRM-03",
    "FX-PR-NRM-04",
    "FX-PR-NRM-05",
    "FX-PR-NRM-06",
    "FX-PR-NRM-07",
    "FX-PR-NRM-08",
    "FX-PR-NRM-09",
    "FX-PR-NRM-10",
    "FX-PR-NRM-11",
    "FX-PR-NRM-12",
    "FX-PR-NRM-13",
    "FX-PR-NRM-14",
    "FX-PR-AGE-01",
    "FX-PR-AGE-02",
    "FX-PR-AGE-03",
    "FX-PR-AGE-04",
    "FX-PR-AGE-05",
    "FX-PR-BMI-01",
    "FX-PR-BMI-02",
    "FX-PR-BMI-03",
    "FX-PR-BMI-04",
    "FX-PR-CAP-01",
    "FX-PR-CAP-02",
    "FX-PR-CAP-03",
    "FX-PR-UNIT-01",
    "FX-PR-UNIT-02",
    "FX-PR-UNIT-03",
    "FX-PR-MEAL-01",
    "FX-PR-MEAL-02",
    "FX-PR-MEAL-03",
    "FX-PR-INV-01",
    "FX-PR-INV-02",
    "FX-PR-INV-03",
    "FX-PR-INV-04",
    "FX-PR-INV-05",
    "FX-PR-INV-06",
    "FX-PR-INV-07",
    "FX-PR-INV-08"
  ],
  "results": [
    {
      "assertion": "TC-FR1-07-AS-01",
      "outcome": "pass",
      "artefact": "artefacts/vitest.json",
      "oracle": "characterisation"
    },
    {
      "assertion": "TC-FR1-07-AS-02",
      "outcome": "pass",
      "artefact": "evidence/FR1-07/artefacts/orc02-comparison.json \u2014 clinical oracle ORC-02 for all in-scope fixtures except FX-PR-CAP-01/02 (known_deviation: DEC-44, compared to characterisation only)",
      "oracle": "clinical"
    },
    {
      "assertion": "TC-FR1-07-AS-03",
      "outcome": "pass",
      "artefact": "artefacts/playwright.json",
      "oracle": "none"
    },
    {
      "assertion": "TC-FR1-07-AS-04",
      "outcome": "pass",
      "artefact": "artefacts/vitest.json",
      "oracle": "characterisation"
    },
    {
      "assertion": "TC-FR1-07-AS-05",
      "outcome": "pass",
      "artefact": "artefacts/vitest.json",
      "oracle": "none"
    },
    {
      "assertion": "TC-FR1-07-AS-06",
      "outcome": "pass",
      "artefact": "artefacts/vitest.json",
      "oracle": "characterisation"
    },
    {
      "assertion": "TC-FR1-07-AS-07",
      "outcome": "pass",
      "artefact": "artefacts/vitest.json",
      "oracle": "characterisation"
    },
    {
      "assertion": "TC-FR1-07-AS-08",
      "outcome": "pass",
      "artefact": "evidence/FR1-07/artefacts/band-table-check.json \u2014 4 BANDS rows not derivable from the cited primary-source figures, reported for HG-02 (DEC-03)",
      "oracle": "none"
    }
  ],
  "mutations": [
    {
      "id": "MUT-07",
      "red": true,
      "run": "local-20261023-1445"
    }
  ],
  "red_run": null,
  "green_run": "local-20261023-1445",
  "human_gate": {
    "id": "HG-02",
    "artefact": "approvals/protein.json, approvals/diabetes.json",
    "status": "pending"
  },
  "started_at": "2026-10-23T14:44:00Z",
  "finished_at": "2026-10-23T14:48:04Z"
}
